{
  "events": {
    "weapon.ua-rifle.fire": {
      "sounds": [
        "synth:shot"
      ],
      "volume": 60,
      "volumeShift": -15,
      "pitchShift": [
        -2,
        2
      ],
      "limit": 3,
      "priority": "normal",
      "control": [
        "random"
      ],
      "type": [
        "world",
        "shrouded",
        "everyone"
      ],
      "minDistance": 4,
      "maxDistance": 40
    },
    "weapon.ua-stugna-p.fire": {
      "sounds": [
        "synth:rocket"
      ],
      "volume": 80,
      "volumeShift": -20,
      "pitchShift": [
        -5,
        5
      ],
      "limit": 5,
      "priority": "normal",
      "control": [
        "random"
      ],
      "type": [
        "world",
        "shrouded",
        "everyone"
      ],
      "minDistance": 4,
      "maxDistance": 50
    },
    "weapon.ua-kozak-hmg.fire": {
      "sounds": [
        "synth:shot"
      ],
      "volume": 75,
      "volumeShift": -10,
      "pitchShift": [
        -5,
        5
      ],
      "limit": 3,
      "priority": "normal",
      "control": [
        "interrupt",
        "random"
      ],
      "type": [
        "world",
        "shrouded",
        "everyone"
      ],
      "minDistance": 4,
      "maxDistance": 40
    },
    "weapon.ua-bushmaster.fire": {
      "sounds": [
        "synth:cannon"
      ],
      "volume": 115,
      "volumeShift": -20,
      "pitchShift": [
        -10,
        10
      ],
      "limit": 2,
      "priority": "normal",
      "control": [
        "interrupt",
        "random"
      ],
      "type": [
        "world",
        "shrouded",
        "everyone"
      ],
      "minDistance": 6,
      "maxDistance": 50
    },
    "weapon.ua-rh120.fire": {
      "sounds": [
        "synth:cannon"
      ],
      "volume": 90,
      "volumeShift": -10,
      "pitchShift": [
        -5,
        5
      ],
      "limit": 2,
      "priority": "normal",
      "control": [
        "interrupt",
        "random"
      ],
      "type": [
        "world",
        "shrouded",
        "everyone"
      ],
      "minDistance": 6,
      "maxDistance": 60
    },
    "weapon.ua-gmlrs.fire": {
      "sounds": [
        "synth:rocket"
      ],
      "volume": 80,
      "volumeShift": -20,
      "pitchShift": [
        -4,
        4
      ],
      "delayMs": [
        0,
        300
      ],
      "limit": 2,
      "priority": "normal",
      "control": [
        "interrupt",
        "random"
      ],
      "type": [
        "world",
        "shrouded",
        "everyone"
      ],
      "minDistance": 8,
      "maxDistance": 80
    },
    "weapon.ua-stugna-emplacement.fire": {
      "sounds": [
        "synth:rocket"
      ],
      "volume": 100,
      "volumeShift": -20,
      "pitchShift": [
        -10,
        10
      ],
      "limit": 3,
      "priority": "normal",
      "control": [
        "interrupt",
        "random"
      ],
      "type": [
        "world",
        "shrouded",
        "everyone"
      ],
      "minDistance": 6,
      "maxDistance": 60
    },
    "weapon.ru-ak74.fire": {
      "sounds": [
        "synth:shot"
      ],
      "volume": 95,
      "volumeShift": -15,
      "pitchShift": [
        -10,
        10
      ],
      "limit": 2,
      "priority": "normal",
      "control": [
        "random",
        "interrupt"
      ],
      "type": [
        "world",
        "shrouded",
        "everyone"
      ],
      "minDistance": 4,
      "maxDistance": 40
    },
    "weapon.ru-rpg7.fire": {
      "sounds": [
        "synth:rocket"
      ],
      "volume": 80,
      "volumeShift": -20,
      "pitchShift": [
        -4,
        4
      ],
      "limit": 2,
      "priority": "normal",
      "control": [
        "interrupt",
        "random"
      ],
      "type": [
        "world",
        "shrouded",
        "everyone"
      ],
      "minDistance": 4,
      "maxDistance": 45
    },
    "weapon.ru-kpvt.fire": {
      "sounds": [
        "synth:shot"
      ],
      "volume": 80,
      "volumeShift": -10,
      "limit": 3,
      "priority": "normal",
      "control": [
        "random",
        "interrupt"
      ],
      "type": [
        "world",
        "shrouded",
        "everyone"
      ],
      "minDistance": 4,
      "maxDistance": 40
    },
    "weapon.ru-2a42.fire": {
      "sounds": [
        "synth:cannon"
      ],
      "volume": 80,
      "volumeShift": -10,
      "limit": 3,
      "priority": "normal",
      "control": [
        "random",
        "interrupt"
      ],
      "type": [
        "world",
        "shrouded",
        "everyone"
      ],
      "minDistance": 5,
      "maxDistance": 50
    },
    "weapon.ru-2a46m.fire": {
      "sounds": [
        "synth:cannon"
      ],
      "volume": 85,
      "volumeShift": -20,
      "pitchShift": [
        -10,
        10
      ],
      "limit": 3,
      "priority": "normal",
      "control": [
        "interrupt",
        "random"
      ],
      "type": [
        "world",
        "shrouded",
        "everyone"
      ],
      "minDistance": 6,
      "maxDistance": 60
    },
    "weapon.ru-tos-thermobaric.fire": {
      "sounds": [
        "synth:rocket"
      ],
      "volume": 105,
      "volumeShift": -10,
      "pitchShift": [
        -10,
        10
      ],
      "limit": 2,
      "priority": "normal",
      "control": [
        "interrupt",
        "random"
      ],
      "type": [
        "world",
        "shrouded",
        "everyone"
      ],
      "minDistance": 8,
      "maxDistance": 70
    },
    "weapon.ru-kornet-emplacement.fire": {
      "sounds": [
        "synth:rocket"
      ],
      "volume": 85,
      "volumeShift": -20,
      "pitchShift": [
        -10,
        10
      ],
      "limit": 3,
      "priority": "normal",
      "control": [
        "interrupt",
        "random"
      ],
      "type": [
        "world",
        "shrouded",
        "everyone"
      ],
      "minDistance": 6,
      "maxDistance": 60
    },
    "weapon.smallArms.fire": {
      "sounds": [
        "synth:shot"
      ],
      "volume": 60,
      "volumeShift": -15,
      "pitchShift": [
        -2,
        2
      ],
      "limit": 3,
      "priority": "normal",
      "control": [
        "random"
      ],
      "type": [
        "world",
        "shrouded",
        "everyone"
      ],
      "minDistance": 4,
      "maxDistance": 40
    },
    "weapon.autocannon.fire": {
      "sounds": [
        "synth:cannon"
      ],
      "volume": 80,
      "volumeShift": -10,
      "limit": 3,
      "priority": "normal",
      "control": [
        "random",
        "interrupt"
      ],
      "type": [
        "world",
        "shrouded",
        "everyone"
      ],
      "minDistance": 5,
      "maxDistance": 50
    },
    "weapon.antiTank.fire": {
      "sounds": [
        "synth:rocket"
      ],
      "volume": 80,
      "volumeShift": -20,
      "pitchShift": [
        -5,
        5
      ],
      "limit": 5,
      "priority": "normal",
      "control": [
        "random"
      ],
      "type": [
        "world",
        "shrouded",
        "everyone"
      ],
      "minDistance": 4,
      "maxDistance": 50
    },
    "weapon.highExplosive.fire": {
      "sounds": [
        "synth:rocket"
      ],
      "volume": 80,
      "volumeShift": -20,
      "pitchShift": [
        -4,
        4
      ],
      "delayMs": [
        0,
        300
      ],
      "limit": 2,
      "priority": "normal",
      "control": [
        "interrupt",
        "random"
      ],
      "type": [
        "world",
        "shrouded",
        "everyone"
      ],
      "minDistance": 8,
      "maxDistance": 80
    },
    "weapon.thermobaric.fire": {
      "sounds": [
        "synth:rocket"
      ],
      "volume": 105,
      "volumeShift": -10,
      "pitchShift": [
        -10,
        10
      ],
      "limit": 2,
      "priority": "normal",
      "control": [
        "interrupt",
        "random"
      ],
      "type": [
        "world",
        "shrouded",
        "everyone"
      ],
      "minDistance": 8,
      "maxDistance": 70
    },
    "weapon.muzzle.fire": {
      "sounds": [
        "synth:shot"
      ],
      "volume": 60,
      "volumeShift": -15,
      "pitchShift": [
        -2,
        2
      ],
      "limit": 3,
      "priority": "normal",
      "control": [
        "random"
      ],
      "type": [
        "world",
        "shrouded",
        "everyone"
      ],
      "minDistance": 4,
      "maxDistance": 40
    },
    "weapon.cannon.fire": {
      "sounds": [
        "synth:cannon"
      ],
      "volume": 90,
      "volumeShift": -10,
      "pitchShift": [
        -5,
        5
      ],
      "limit": 2,
      "priority": "normal",
      "control": [
        "interrupt",
        "random"
      ],
      "type": [
        "world",
        "shrouded",
        "everyone"
      ],
      "minDistance": 6,
      "maxDistance": 60
    },
    "weapon.rocketLaunch.fire": {
      "sounds": [
        "synth:rocket"
      ],
      "volume": 80,
      "volumeShift": -20,
      "pitchShift": [
        -4,
        4
      ],
      "delayMs": [
        0,
        300
      ],
      "limit": 2,
      "priority": "normal",
      "control": [
        "interrupt",
        "random"
      ],
      "type": [
        "world",
        "shrouded",
        "everyone"
      ],
      "minDistance": 6,
      "maxDistance": 70
    },
    "weapon.backblast.fire": {
      "sounds": [
        "synth:rocket"
      ],
      "volume": 80,
      "volumeShift": -20,
      "pitchShift": [
        -4,
        4
      ],
      "limit": 2,
      "priority": "normal",
      "control": [
        "interrupt",
        "random"
      ],
      "type": [
        "world",
        "shrouded",
        "everyone"
      ],
      "minDistance": 4,
      "maxDistance": 45
    },
    "weapon.softLaunch.fire": {
      "sounds": [
        "synth:rocket"
      ],
      "volume": 80,
      "volumeShift": -20,
      "pitchShift": [
        -5,
        5
      ],
      "limit": 5,